Item (EN),Category/Department (EN),Description (EN),Variant Name
Adidas Unisex Boxing Gloves Hybrid - 50,Boxing Gloves,"Hybrid - 50 boxing gloves is made from a high quality PU material to provide maximum durability and great shock absorption protecting your fist and knuckle during a boxing workout. Provided with internal lining on the inside for optimal comfort and great fit. Wide velcro closing system to provide strong quick adjustment, wrist protection and maximum support. Helps you deliver a firm and perfect punch with high speed and excellent execution. These Adidas gloves are suitable for fitness classes, kickboxing and boxing. Available for kids and adults with different colors and sizes.",10oz
Weight Plate,Bars / Plates,"Made of solid cast iron and coated in black rubber to add a layer of protection for fitness equipment and floors and safety for the user. Weight plates can be used to perform muscle strengthening exercises and endurance training, and to increase flexibility and balance. A single weight plate can also be used for warm-up exercises.",20kg
Exercise / Yoga Mat,Yoga Mat,"The exercise / yoga mat can be used for almost any floor exercise at home or in classes. This mat is soft and comfortable made from EVA (ethylene vinyl acetate) foam rubber - ideal for yoga, fitness or pilates. Slightly longer and wider than the majority of fitness mats can be used also without any problems e.g, on the beach.",150L x 60W cm (59”x 23.6”) T: 6.5 mm
Exercise / Yoga Mat,Yoga Mat,"The exercise / yoga mat can be used for almost any floor exercise at home or in classes. This mat is soft and comfortable made from EVA (ethylene vinyl acetate) foam rubber - ideal for yoga, fitness or pilates. Slightly longer and wider than the majority of fitness mats can be used also without any problems e.g, on the beach.",173L x 61W cm (68”x 24”) T: 4 mm
"Body Sculpture Core Push Up Grips, 2 kg, Multi-Color, Multiple Positions",Fitness Accessories,"Interchangeable handles allow for multiple positions to target your upper body, each colour-coded to match specific muscles. Instability resistance is great for increasing difficulty to work on a wider range of muscles. It can be removed for flat workouts. Made from abs for durability. Develop your upper body; core strength. Easy assembly.",
Body Sculpture Dumbbell Bar Hand with Locks,Bars / Plates,"The dumbbell bar with locks are easy to use and can be utilized by beginners and advanced weightlifters. It of high-quality steel and has a sturdy and durable structure. The fully adjustable design makes the installation and disassembly of the plates easy. Each handle features a brilliant chrome finishing to increase durability. These weight plates are fixed by star lock rings to prevent them from slipping during exercise. Complete arm muscle training device-designed to directly strengthen the strength of the biceps, triceps and forearm muscles, can enhance the strength, strength and control of the arm.",
Shin & Instep Guard,Boxing Accessories,Shin & instep guard is made from 100% woven polyester with safety break away. Adidas shin guard is padded for maximum safety and provided with foot protection.,XL
Body Sculpture Neoprene Kettlebell,Dumbbells and Kettlebells,"Neoprene kettlebells are made from solid cast iron with a protective neoprene coating; which helps make it floor friendly. Also, the product features an easy grip handle. The neoprene kettlebell provides progressive training, making it perfect for at home gyms. Its ideal for building muscle, flexibility, and it assists in building core strength; as its both an intense and effective whole body workout.",2kg
Body Sculpture Neoprene Kettlebell,Dumbbells and Kettlebells,"Neoprene kettlebells are made from solid cast iron with a protective neoprene coating; which helps make it floor friendly. Also, the product features an easy grip handle. The neoprene kettlebell provides progressive training, making it perfect for at home gyms. Its ideal for building muscle, flexibility, and it assists in building core strength; as its both an intense and effective whole body workout.",4kg
Lateral Speed Resistor,Jogging Kit,"The lateral speed resistor is ideal for resistance exercises that will help you increase bone density, improve metabolism, strengthen your lower body muscles, and helps the user maintain correct body positioning. The lateral speed resistor works on developing strength, balance, speed and first-step quickness of the user. The product features a padded, velcro adjustable ankle cuff that reduces friction and improves comfort to the user. The cord is extremely durable as its a bungee cord. For maximum safety of the user while exercising, the protective outer cover safely contains the resistance tube.",
Fitness Loop,Loops / Bands,"The fitness loop is ideal for adding both resistance and assistance to your workout routine, adds variety to your workout, great for warm up exercises pre-workout; As it helps prevent any possible injuries and primes you for your workout session. The product works on improving your mobility (range of motion). Is also ideal for, body building and aerobic exercises. The product is eco-friendly as its made from natural latex rubber.",3.2cm
"Body Sculpture Hex Dumbbell, Rubber with Iron Handles, Multi Weights",Dumbbells and Kettlebells,"The hex dumbbells are ideal for training at home. Lift the workout to the next level and perform exercises for: Biceps, triceps, shoulders, chest, back and legs by using the hexagonal dumbbells. Protect any surface from scratches by the soft rubber with which the ends are exaggerated. The knurled grip on the chrome handles ensures stability and easy gripping. These dumbbells are also designed to be used as push up bars. Please note: These dumbbells are sold in singles.",2kg
"Body Sculpture Hex Dumbbell, Rubber with Iron Handles, Multi Weights",Dumbbells and Kettlebells,"The hex dumbbells are ideal for training at home. Lift the workout to the next level and perform exercises for: Biceps, triceps, shoulders, chest, back and legs by using the hexagonal dumbbells. Protect any surface from scratches by the soft rubber with which the ends are exaggerated. The knurled grip on the chrome handles ensures stability and easy gripping. These dumbbells are also designed to be used as push up bars. Please note: These dumbbells are sold in singles.",3kg
"Body Sculpture Hex Dumbbell, Rubber with Iron Handles, Multi Weights",Dumbbells and Kettlebells,"The hex dumbbells are ideal for training at home. Lift the workout to the next level and perform exercises for: Biceps, triceps, shoulders, chest, back and legs by using the hexagonal dumbbells. Protect any surface from scratches by the soft rubber with which the ends are exaggerated. The knurled grip on the chrome handles ensures stability and easy gripping. These dumbbells are also designed to be used as push up bars. Please note: These dumbbells are sold in singles.",9kg
Rubber Yoga Mat,Yoga Mat,"The rubber yoga mat benefits the user in ease of movement, with its soft and extra slip resistance material for excellent traction and stability. It is easy to clean and washable.",
MMA Gloves,Boxing Gloves,"Constructed with a durable PU leather from the exterior to endure long-lasting training sessions and sparring, along with knuckle padding from EVA foam material. Provided with climacool technology to keep the athletes hand cool and dry. Presented with adjustable and firm velcro closing system. The speed fight gloves is available in different sizes: S, m, l, and xl.",L
MMA Gloves,Boxing Gloves,"Constructed with a durable PU leather from the exterior to endure long-lasting training sessions and sparring, along with knuckle padding from EVA foam material. Provided with climacool technology to keep the athletes hand cool and dry. Presented with adjustable and firm velcro closing system. The speed fight gloves is available in different sizes: S, m, l, and xl.",S
Super Pro Shin-n-Ship Guard,Shin Guard,Adidas Super Pro Shin-n-Ship is constructed of flx 3.0 PU leather from the outer surface. Provided with i-comfort + for maximum comfort and quick drying fabric lining. Added with durable EVA foam padding and gel insert on the front. These shin guards have foot protection and twin hook and loop strap for a perfect fit. The product is available in different colors and sizes.,L
Sandbag with Chains 180,Punching Bag,Punching bag made of resistant PU with woven backing. Suspended by metal chains and ‘d’ metal ring for hanging the bag on ceiling. Auto-lock slider zipper. This accessory has been filled with textile cuttings only and electronically scanned for your protection. Nice adidas logo printed on the bag. Specifications: Suspended by metal chains with ‘d’ metal ring for hanging the bag on ceiling. Auto-locking slider zipper. This punch bag has been filled with textile cuttings only and electronically scanned for your protection. Dimensions: 180 x 33 cm.,
Body Sculpture Leather Weight Lifting Gloves,Body Sculpture,"The leather weight lifting gloves is ideal for weight-lifting sessions. As it protects your fingers from any possible injury or irritation during working out, it features wrist straps designed to aid with wrist support for lifting weights, performing cross training, olympic lifts like snatches, clean and jerks, front squats, and other various lifts requiring wrist protection. The design also features a padded palm for maximum comfort for the user.",S
